Conference Name,Location,Call for Papers Deadline,Conference Date,Submission Fee,Website
Yale Machine Learning in Finance Conference,"New Haven, CT",8/1/2020,11/20/2020,0,https://som.yale.edu/event/2020/11/yale-machine-learning-in-finance-conference
Brandes Institute Call for Academic Papers Contest,,11/30/2020,,,https://www.brandes.com/docs/default-source/brandes-institute/call-for-academic-papers-contest.pdf
Financial Consequences of the COVID-19 Pandemic,Online,9/15/2020,10/12/2020,0,https://research.chicagobooth.edu/famamiller/financial-consequences-of-covid-19/call-for-papers
AFA PhD Student Poster Session,Chicago,7/31/2020,1/3/2021,0,https://afajof.org/annual-meeting/
ECB-RFS Macro-Finance Conference,Frankfurt,11/15/2020,3/22/2021,0,https://www.ecb.europa.eu/pub/conferences/html/20210322_ecb_rfs_macrofinance_conference_CALL.en.html