Conference Name,Location,Call for Papers Deadline,Conference Date,Submission Fee,Website
Brandes Institute Call for Academic Papers Contest,,11/30/2020,,,https://www.brandes.com/docs/default-source/brandes-institute/call-for-academic-papers-contest.pdf
Financial Consequences of the COVID-19 Pandemic,Online,9/15/2020,10/12/2020,0,https://research.chicagobooth.edu/famamiller/financial-consequences-of-covid-19/call-for-papers
ECB-RFS Macro-Finance Conference,Frankfurt,11/15/2020,3/22/2021,0,https://www.ecb.europa.eu/pub/conferences/html/20210322_ecb_rfs_macrofinance_conference_CALL.en.html
Southwestern Finance Assoc. Annual Meeting,"Galveston, TX",10/2/2020,3/17/2021,35,http://editorialexpress.com/conference/SWFA2021/
Eastern Finance Assoc. Annual Meeting,Online,10/2/2020,4/7/2021,50,https://www.openconf.org/efa2021/
