Conference Name,Location,Call for Papers Deadline,Conference Date,Submission Fee,Website
CDI Ninth Conference on Derivatives,Montreal,5/17/2020,9/24/2020,0,https://cdi-icd.org/en/annual-conference/
Paris December Finance Meeting,Paris,6/4/2020,12/17/2020,45,https://www.paris-december.eu/
Moskowitz Prize for Outstanding Research in Sustainable and Responsible Investing,,6/30/2020,,0,https://www.kellogg.northwestern.edu/social-impact/academics/moskowitz-prize.aspx
Yale Machine Learning in Finance Conference,"New Haven, CT",8/1/2020,11/20/2020,0,https://som.yale.edu/event/2020/11/yale-machine-learning-in-finance-conference
Brandes Institute Call for Academic Papers Contest,,11/30/2020,,,https://www.brandes.com/docs/default-source/brandes-institute/call-for-academic-papers-contest.pdf
